stars,comment
4,bốn sao cũng được
5,tôt hài_lòng với sản_phẩm
5,rất tốt tooii đã dùng balo của lata được năm rồi mà vẫn chưa bị hư_chất da và đường may đều tốt tôi đã đặt chiếc túi này cho tôi và cho chị gái với giá khuyến_mãi đặt hôm_qua hôm_nay đã nhận được rồi tôi thật_sự rất hài_lòng với sản_phẩm của lata
5,giống với ảnh đáng mua chất_liệu ưng_ý hài_lòng với sản_phẩm
3,ba sao oke
4,bốn sao
5,năm sao tốt
5,tui deo cheo tui deo cheo thuong hieu lata mau deu rat đẹp chat luong rat tot gia ca qua re so voi tat ca nhung gi that tot cua_san pham
4,tốt đep
4,bốn sao sản_phẩm tốt_đẹp y hình nhưng gửi chậm so với thời_hạn ngày chờ mãi mà chả nhận được tưởng trôi luôn chơ đóng_gói cẩn_thận
5,năm sao chất_liệu ok
5,năm sao túi đẹp mình rất thích nhưng bé mình đựng cái ví điện_thoại mấy thỏi_son và hũ kem dưỡng ẩm loại bé là full rồi
5,tốt trên cả tuyệt_vời
4,giá đẹp mới mua là kgiờ là không hàng đẹp đómong chuyến hàng không với chất luợng không đổicần thời_gian xem da có bị nổ nhanb kcpnf bây_giờ thấy là ok
5,rất ok rất hài_lòng
4,ok gia thanh okminh mua luc tui sale con kchat lieu day danhop voi tui tienchi tiec la minh_chon da bo nhat thi lazada lai giao cho da bo_dam
4,chat lieu tot mau ma đẹp va giao hang nhanh hon du kien san pham chat luong tot mau ma đẹp toi rat hai long
4,bốn sao chất lương và mẫu_mã ổn sản_phẩm giống hình phù_hợp để đi chơi bạn có_thể để vừa cả loại ví dài nên mua
5,sản_phẩm rất tốt hợp giá tiền đẹp
4,sản_phẩm đẹp đặt_hàng nhanh
5,tui chat luong hang chat luong lazada nen phat huy_nhe
4,tui đẹp vua y đẹp
3,tien nao cua do cung ok lam_cung tot
5,năm sao túi da_bò nhạt này đẹp hơn cái màu đậm đợt rồi mình mua đó mà sử_dụng tốt nên mua thêm cho em mình một cái để dùng nói_chung cũng được xài tốt
4,đẹp đẹp đúng như hình nhưng cái ví tặng theo nhìn khó diễn_tả quá d
5,rất hài_lòng chất_liệu da làm túi trong không được chuẩn cho lắm nhưng so với giá_cả thì mềm rồi chiếc túi mình có_thể mang đi làm cũng hợp_lý màu_sắc chiếc túi đẹp dây đeo khá cứng_cáp
5,tuyệt_vời giá không mà đường chỉ chắc_chắn da dày mình cực_thích phần bên trong tuyệt sẽ tiếp_tục mua của lata
5,năm sao tốt
4,bốn sao nhin ok gia lai re
5,năm sao
5,tuyệt đã nhận được hàng nhìn_chung rất thích
5,túi lât vn mình rất rất hài_lòng về chiếc túi nàychất_liệu da_mềm và dễ_thương nữa
5,sao túi da mềm rẻ và đẹp tôi rất hài_lòng sản_phẩm này
5,tốt cực tốt hàng đã nhận chiều nay và đặt thêm cái mong là đẹp giốg y_vậy
5,hàng đẹp chất_lượng
5,tốt túi đẹp
4,bốn sao tốt
4,hàng như miêu_tả chắc_chắn giao hàng sớm các nhận_xét của mọi người về đường may chắc_chắn chất_liệu đẹp và lót trong mềm dày_dặn đều đúng các khóa khớp nối dày chắc giao hàng miễn_phí sớm một tuần so với dự_kiến dây đeo chắc nhưng đoạn gậpđiều chỉnh chưa đẹp lắm so với túi nên cho sao tổng_thể hài_lòng với giá hợp_lý không miễn_phí vận_chuyển đợt khuyến_mại
5,dùng được rất ổn so với giá tiền
3,hàng cũng được nhưng hơi thất_vọng do quá nhỏ không đựng được nhiều đồ bên trong không giống như mô_tả
5,rất hài_lòng d
5,năm sao hài_lòng
5,túi có thiết_kế đơn_giản khá đẹp_mắt da_bò đẹp đeo nhìn rất năng_động thoải_mái đựng được khá nhiều đồ
4,tốt năm trước ưu_điểm chất_lượng tốt hình_ảnh giống như hình có bảo_hành và địa_chỉ công_ty sản_xuất chưa hài_lòng thể_tích của túi hơi nhỏ
5,rất tốt tôi hài_lòng
5,rất tốt tuy_nhiên đường chỉ mai chưa chính_xác
5,lata tốt
5,rất thích hàng giống_hình da_mềm nhìn đẹp giao hàng siêu nhanh
5,tốt hơn mong_đợi khi đặt_hàng mình chọn chế_độ giao hàng tiết_kiệm nên nghĩ cả tuần sau mới có mình ở bình dương ai dè ngày sau có rồi nói chubg rất hài_lòng chỉ là gói sản_phẩm không kỹ cho lắm dễ bị gãy da của mình nguyên ven không gãy hàng đẹp da dày nói_chung với giá không mình rất hài_lòng
5,năm sao túi đúng như mô_tả da tốt
4,tốt túi như hình tiếc là mua không đúng dịp lazada giảm nhiều nhất
5,da_mềm nói_chung là cũng được so với giá_thành
5,hài_lòng về sản_phẩm
5,sản_phẩm rất đẹp so với chất lương thì giá tiền rất ok đẹp rẻchất lg
5,sản_phẩm rất đẹp bên trong lớp lót nhung dày_dặn nên mua
4,bốn sao
5,tốt màu đẹp hơn ảnhchất liệu mềm_mại bền đường may chắc_chắn form không đứng lắm nói_chung là ok
4,ok sản_phẩm đẹp giá_cả hợp_lí
3,ba sao san pham đẹp gia re
5,tốt chất vải dày lắm ak mọi ngk trên đây rẻ chứ chỗ khác không trở lên không ak
5,túi đẹp
3,khá là thích sản_phẩm_chất_liệu da làm túi trong không được chuẩn cho lắm nhưng so với giá_cả thì mềm rồi chiếc túi mình có_thể mang đi làm cũng hợp_lý màu_sắc chiếc túi đẹp dây đeo khá cứng_cáp
5,tuyệt_vời hàng đóng_gói rất cẩn_thận mở ra thì ôi ưng_ý cực_kỳ luôn hàng giá rẻ mà chất_lượng quá ok luôn sắm em túi này ban_đầu mục_đích để đi chùa cơ_mà đi chơi cũng rất ok
5,năm sao
3,rất hài_lòng
5,hàng tốt sản_phẩm đúng mô_tả gía_rẻ
5,quá tốt da mềm đẹp săn được giá hời không mà túi đẹp quá_chừng cảm_ơn lata lazada
5,ok tot
4,giá rẻ mà đẹp
4,tui đẹp cung kha hai long
5,rất hài_lòng ủng_hộ lata tuyệt_đối
5,hài_lòng màu túi đậm hơn trong hình túi đẹp các đường may đều đẹp lớp lót túi đủ dày khóa trơn_tru nhìn chung sản_phẩm tốt mua lúc giá không đã thấy rẻ rồi mà giờ còn không
3,ba sao năm trước ok
5,tốt giao hàng rất nhanh và bạn shipper nói_chuyện rất thân_thiện sản_phẩm thì mình thấy ok đợi dùng thời_gian xem thế_nào rất ủng_hộ
3,ba sao sản_phẩm giống hình sản_phẩm tốt giá rẻ
3,tốt túi đẹp hàng tốt giá tốt
5,tốt chất_lượng sản_phẩm với giá chấp_nhận được rẻ hơn mua ngoài chợ giao hàng tốt
4,tốt sản_phẩm y hình chất_lượng tốt
5,chất_lượng tốt giao hàng nhanh gói hàng cũng đẹp nữa về chiếc túi thì mẫu_mã giống trong mô_tả dây đeo chắc_chắn nhưng có_điều màu hơi nhạt hơn so với trong hình tý nhưng sản_phẩm_chất_lượng rất ok
3,ba sao sản_phẩm giống trong hình tốt
5,năm sao tuyệt
3,ba sao chất_lượng và giá_cả hợp_lý
5,túi da rất ok mình rất ưng_ý ngoài sự mong_đợi rất ok
3,lata tạm hài_lòng
5,năm sao sản_phẩm rất tốt khi nhận được sản_phẩm vô_cùng vui_mừng vì mua hàng nhanh chất lg tốt tiết_kiệm được thời_gian lựa choncảm ơn_lazada
4,tốt màu đẹp sản_phẩm giống với hình da mềm khóa chắc_chắn đường chỉ may đẹp
5,hài_lòng túi dày_dặn đẹp giống hình mua được giá rẻ nữa
3,ok hàng đẹp giao nhanh
5,túi mang chéo lata hàng đạt yêu cầugiao hàng đúng hẹn
5,phù_hợp với giá sản_phẩm hài_lòng_đường mai đẹp
3,ba sao năm trước day đeo hoi nho và yếu_ớt
5,năm sao quần mềm_mại mặc dễ_chịu giá rẻ tuy_nhiên cúc hơi khó hiểu
5,ok ok
5,ăm sao túi có thiết_kế đơn_giản khá đẹp_mắt da_bò đẹp đeo nhìn rất năng_động thoải_mái đựng được khá nhiều đồ
5,rất đáng mua chất_liệu tốtđường may kĩ càngmáu sắc_đẹp
2,tiền nào của nấy da xấu dễ rách và đã đứt quai sau tháng sử_dụng
5,năm sao giao hang nhanhda dept rat thich mua hang tai lazada
3,bề_ngoài túi thì ok nhưng bên trong vải hơi xấu túi hơi cứng
4,bốn sao nhìn đẹpbên trong túi nhìn sang bền
4,tốt da tốt
1,ok tôi hài_lòng
5,năm sao đẹp i như hình
4,hàng ok mới đặt_hàng ngày đã có tại bình thuậnhàng rẻ mà rất ok
4,bốn sao túi giống như hình đẹp rất thích
4,sản_phẩm tốt mình khá ưng_ý với sản phẩmgiá cả phải_chăng da_mềm kích_thước hợp_lý màu_sắc hơi tối hơn mình nghĩ nhưng dễ phối đồví tặng kèm cùng màu với túi nên thành set đẹp đấyhi
1,túi mùi kinh lắm
5,tốt chất_lượng tốt da đẹp hàng giao đúng mẫu_mã
4,tốt sản_phẩm như hình đường may đẹp và chắc_chắn
5,tốt túi ok
5,năm sao chất_lượng rất tuyệt_vời
3,ba sao
5,năm sao
5,sản_phẩm tốt gio sach đẹp hai long vua matduong may chac chan
5,tốt tốt
1,quá xấu so với hình lại còn thiếu ví khuyến_mãi nữa mất khách
5,tuyệt_vời sản_phẩm đẹp bắt_mắt mới đặt trưa hôm_qua hôm_nay đã có mới nên chưa biết bền không nhưng cảm_nhận đầu là thấy ổn đó
1,miêu_tả đẹp hoành tráng_lệ lắm khi nhận thì cảm_thấy chỉ đc sao
4,bốn sao tốt
5,nhận hàng sớm hơn mong_đợi hàng rất ok nhân_viên giao hàng rất nhiệt_tình_cảm_ơn hệ_thống
5,năm sao tôi rất hài_lòng về giá_cả cũng như chất_lượng hàng mà tôi đã mua
2,túi bằng chất_liệu da quá mềm không biết do túi như_vậy hay do khâu đóng_gói vận_chuyển mà lúc nhận đc hàng cái túi nhăn nhàu gãy hết cả túi
5,năm sao sản_phẩm cực_kì chất_lượng cầm êm tay đường may tinh_tế giao hàng nhanh
5,năm sao túi đeo rất đẹp da cũng là hàng chất_lượng đó mình dùng vài tháng rồi có bị dính mưa dính nước mà da vẫn không sao rất hài_lòng nhé
5,tui xách rất hài_lòng cám_ơn lazada
3,tam_duoc
4,hải lòng về sản_phẩm hàng giao nhanh hơn dự_kiến túi giao như hình màu đậm hơn da mềm đường may đẹp có_điều ví tặng kèm không ưng_ý lắm góp_ý với lazada không nên tặng kèm ví như_vậy thay_vì tặng kèm ví lazada có_thể bớt tiền trên sản_phẩm để tăng uy_tín hoặc giá_trị sản_phẩm hàng dùng bền hay không thì chưa thể đánh_giá được nhưng sản_phẩm được bảo_hành trọn đời thì ok
5,tui đẹp hop gia tien mau san pham_đẹp da mem phia trong vai lot đẹp hop voi mau tui gia re so voi chat luong san pham nhan vien giao hang vui ve_va nhiet tinh
4,hài_lòng giao hàng nhanh sản_phẩm nhận được đúng với mẫu giá_thành vậy là ok
5,san pham tot ung y mau đẹp gia ca hop ly toi rat hai long_haonguyen
5,hài_lòng về sản_phẩm giao hàng miễn_phí nhưng khá nhanh sản_phẩm nhận được đúng mô_tả chất_liệu đẹp giá_thành rẻ hài_lòng
3,túi đeo chéo khi nhấp chuột đặt mua túi với giá không lúc thanh_toán mình nghĩ trong đầu túi rẻ_vậy mua thử dùng tạm thôi chứ không hề nghĩ khi nhận được hàng lại cảm_thấy ok đến như_vậy các sản_phẩm khác mình không biết như nào nhưng khi nhận đc túi đeo chéo này mình thấy hài_lòng chất_liệu ok chắc_chắn và đeo rất hợp đến cả ông anh zai khó_tính của mình còn nói là chất được đấy nói_chung là quá hài_lòng đi
5,san pham tui cheo hang duoc dong goi rat ky luong giao hang cung nhanh nua ve_san pham thi minh rat ung_y
5,tốt sản_phẩm đẹp đúng như hình mình rất hài_lòng
5,rất đẹp rất là ưng_ý ạ
1,túi xấu
5,hài lòg rẻ đẹp
4,được minh moi nhan hang hom warat hai long ve_gia ca va san pham
4,chi mình thích túi này vì với giá tiền để mua được túi da_mềm và màu_sắc giống hình thì rất hài_lòng mình cũng thích sự nhanh_chóng của việc giao hàng lazada cám_ơn
4,đẹp giao hàng nhanh nhận đc sản_phẩm nhanh hàng đẹp to hơn so với tưởng_tượng da mềm đường may chắc màu_da hơi nhạt so với hình
5,năm sao giao hang nhanh sản_phẩm rất ung_y bền trong rất đẹp đuong chi chac chan
3,rất tốt túi giống y hình chất_lượng cũng rất tốt mình rất hài_lòng
5,túi đẹp rất hài_lòng
2,mới nhận hàng xong giờ còn tiec quá
5,năm sao hài_lòng sản_phẩm
3,anh ba sao_binh thuong
5,sản_phẩm đẹp giống với mô_tả chất_lượng tốt so với tầm giá này cảm_ơn lazada làm_quà tặng rất ý_nghĩa
5,túi rẻ đẹp túi đẹp chắc_chắn dầy_dặn kích_thước vừa phải tiện_dụng cho mình khi đi shopping
4,bốn sao hài_lòng về sản_phẩm
5,tốt tốt
5,sản_phẩm đúng mô tảgiao hàng nhanhgiá tốt sản_phẩm rất đúng mong đợigiá tốtlazada cần có thêm nhiều mặt_hàng như_vậy
3,hi duoc thoi chua như mong_muốn
5,tuyệt_vời sản_phẩm như mô_tả hàng chất_lượng hi_vọng cửa_hàng sẽ luôn phục_vụ và đáp_ứng tốt nhu_cầu chất_lượng của mỗi sản_phẩm hàng giá phải_chăng tôi rất hài_lòng về sản_phẩm
5,năm sao sản_phẩm rất đẹp
5,hai long ve_sản_phẩm va dich vu cua lazada tui xach đẹp gia re giao hang nhanh cam on lazada
5,năm sao hàng đẹprất hài_lòng
4,đẹp đẹp
5,hài_lòng sản_phẩm đúng như hình_mẫu da mềm kiểu_dáng đẹp rất nên mua
1,túi mỏng dởm nên rẻ thích_hợp cho mấy bạn nhỏ đựng bút viết
5,tuyệt_vời mình và bạn mua cái hàng đẹp đường chỉ đẹp da mềm giao đúng hẹn nói_chung ok
4,rất hài_lòng giao hàng đúng hẹn mình hài_lòng với dịch_vụ túi đeo nhận được giống mẫu rất đẹp kiểu_dáng độc_đáo mình rất hài_lòng với sản_phẩm này
5,đẹp và rẻ
3,ba sao ok
4,tốt da dày đẹp giống trong hình
3,ba sao nhìn thấy ổn nhưng nữ sử_dụng tiện_lợi hơn
1,chất_liệu không giống ảnh chất_liệu là vải da lộn nhìn không đẹp chút nào
5,đẹp giá ổn rất tốt khi nhận sản_phẩm vừa_ý mong rằng time sử_dụng lâu_dài
4,ok theo nx của mình bề_ngoài ok lòng trong hơi hẹp không rông rãi như mình nghĩ còn về chất_lượng lâu_dài mới biết vì mình đã từng sử_dụng túi lata một lần bị tróc keo tùm_lum tặng ox mà nghe chê quê hết_sức
5,tốt da mềm túi đẹp mẫu ma giống hình
3,ba sao phù_hợp cho teen da tốt
5,hàng tốt chất_lượng cực_kỳ tốt so với giá tiền chất_liệu đẹp đường may chắc_chắn
5,đoàn chất_lượng tốt sản_phẩm đúng hãnggía rẻ hơn rất nhiều so với cửa_hàng nhưng vẫn được bảo hànhda đẹp
5,ok đẹp
3,tui đẹp
5,năm sao tuyệt_vời hơn cả mong_đợi cám_ơn cửa_hàng
5,đẹp túi da đẹp dày_dặn mình rất thích
4,với giá đó thì sản_phẩm ok
4,hài_lòng đẹp hài_lòng với chiếc mẫu_mã như mình đã xem trên hình rất giống bên trong có nhiều ngăn nhỏ đựng dụng_cụ điện_thoại chế_độ bảo_hành làm mình yên_tâm giá chiếc túi cũng khá là hợp_lý cảm_ơn lazada
1,nhảm_nhí hàng giá rẻ ghi thông_tin không nói chất gì với giá_như_vậy chỉ có chất pu dùng vài hôm hỏng mua cho phí tiền
5,ok lắm giống như mô_tả chất_lượng tốt da rất tốt
5,tốt san phẩm nhu_hình
5,rất đẹp sản_phẩm giống_hình da đẹp đường chỉ may chắc_chắn bên trong lót lớp vải nhung rất đẹp nhận sản_phẩm xong mình rất hài_lòng và bạn_bè đồng_nghiệp đã nhờ mình mua đến cái nữa mua cả màu luôn sau khi mình mua sản_phẩm này thì bạn mình đã tìm đến lazada để mua hàng rất nhiều
5,năm sao sản phẩn tốt so với giá
4,bốn sao mẫu_mã hàng như hình giao hàng nhanh_chóng_chất da đẹp giá vừa túi_tiền
5,năm sao
5,tốt tôi rất hài_lòng sản_phẩm đẹpda tốt lazada phục_vụ rất tận tìnhgiao hàng nhanhcảm ơn nhân_viên giao hàng nhé rất nhiệt_tình
2,hai sao khi mua cái túi này đầu_tiên cho chị hai mình thấy rất đẹp nên năm sau mình đặt thêm cái nữa nhưng cái thứ mình nhận được kém xa cái đầu_tiên mình mua da thì nhũn đường may thô không còn đẹp như trước kích_thước cũng khác nhau cái túi mua sau lại trông cũ hơn cả cái túi trước mình rất thất_vọng
5,hài_lòng kích_thước vừa phải dây đeo chắc_chắn vải lót dày và êm giá thì quá là hạt dẻnói chung là quá hài_lòng cám_ơn lazada
4,bốn sao sản_phẩm cũng đc nhưng nhìn thô quá không kĩ và đẹp nhubg so với giá tiền thì sd đc
1,nhăn nhoe xấu không như_ý hơi thất_vọng xấu
5,rất hài_lòng hình sao hàng vậy cảm_ơn lazada nhiều
4,bốn sao da rất mềm mình rất thích cái giỏ xách này cảm_ơn lazada
5,năm sao sản_phẩm bên ngoài đẹp hơn trong hình
5,năm sao tôi hài_lòng
2,hai sao tui nho so voi hinh tam_duoc
5,túi lata túi dày chỉ may chắc_chắn giao hàng đúng ngày hài_lòng với sản_phẩm
4,giá tốt trước túi có chất_lượng tốt so với đơn_giá không tuy_nhiên mùi da vẫn còn nồng đường may có mũi kim_hơi dài
5,năm sao túi da_bò nhạt này đẹp hơn cái màu đậm đợt rồi mình mua đó mà sử_dụng tốt nên mua thêm cho em mình một cái để dùng nói_chung cũng được xài tốt
3,túi nhìn trông thô nhỏ hơn tí nữa thì đẹp
5,hàng tốt với giá này thì là quá tốttúi hoàn_thiện cũng đẹpđường may chắc_chắn
5,sản_phẩm đẹp sản_phẩm đẹp duong chi may chac chan
5,rất rẻ rất tốt
5,năm sao túi đẹp giống hình mình thích cái ví quà tặng hơn cảm_ơn lazada nhe
5,hang y hinh ok
5,năm sao tôi hài_lòng
5,tot tot
5,hàng ok túi đẹp giao hàng nhanh nhân_viên nhiệt_tình mình sẽ tiếp_tục ủng_hộ
5,năm sao túi này đeo gọn_gàng mà tiện_lợi lắm đựng được nhiều món đồ cần_thiết hằng ngày để mang đi mà lấy ra bỏ vô đều rất là nhanh đã vậy còn được tặng ví cầm tay nữa cả cái đều dùng rất là ok
5,túi đẹp da dầy_dặn quá tốt so với giá
5,năm sao năm trước rất hài_lòng sản_phẩm giốn hình giao hàng nhanh giá hợp_lý rất ok
5,rẻ đẹp da mềm mẫu_mã như hình đường may ok giá rẻ
5,tốt
3,sản_phẩm tạm được
5,năm sao rất đẹp
3,màu_da xấu hơn trong hìnhchất da khá ổn
5,năm sao sản_phẩm giống hình chất_liệu da và đường may ok tôi thật_sự rất hài_lòng với sản_phẩm của lata
5,chat luong tot
5,năm sao túi y hìnhda mềmhơp túi tiềngiao hàng nhanhủng hộ lazada
5,rẻ đẹp mình mua đúng hôm giảm còn không nay nhận hàng rất là ưng luôn ý
4,sản_phẩm tốt sản_phẩm tốt
4,đánh_giá sản_phẩm nhìn_chung thì lazada cũg nổi_tiếng từ lâu rồi mình cảm thấy yên_tâm khi mua hàg về phần sản_phẩm thì ok hàg y hình chất_lượng tốt mong rằg cty tiếp_tục pt
