stars,comment
5,túi rất đẹp túi đẹp may kĩ và tiện_lợi khi bên trong và bên ngoài đều có túi nhỏ dây kéo_lại đẹp nói_chung là rất đáng tiền mua
4,bốn sao mẫu_mã và chất_lượng y_hình
5,năm sao đẹp
5,năm sao verry nice i love it
5,tot san pham giong_hinh da_đẹp
5,năm sao đẹp
5,tuyệt chỉ ngày mà mình đã nhận được hàng hàng rất đẹp mình thích lắm lun á
3,sao tôi rất hài_lòng về sản_phẩm cảm_ơn lazada
5,túi đẹp và tiện_dụng đã mua thêm cái nữa và còn mua thêm nữa
4,túi đẹp có vài chỗ đường chỉ bị may chồng lên nhau nhưng nhìn chung túi đẹp chắc_chắn giá rẻ so với chất_lượng mình rất thích sản_phẩm này
5,tốt sản_phẩm vừa tầm giá chất_lượng
4,danh gia đẹp nhưng túi hơi nhỏ
5,năm sao đẹp lắm rất thích
3,ba sao hài_lòng với sản_phẩm này cực_kỳ lần sau sẽ mua hàng trên lazada tiếp
5,tui xach lata minh mua ve_rat hai long chat_lieu da tot ma_lai vua tui tien nua mjnh rat thich sản_phẩm nay
5,hang đẹp nhu_hibh nhun chac chan ben đẹp ok
1,hàng đúng như hình nhưng trên website có tặng kèm ví mà nhận không có
5,năm sao hàng đẹp tốt
5,rất tốt hàng nhận giống hình chất_liệu đẹp phù_hợp với giá tiền
5,quá đẹp đã nhận được hàng quá đẹp phải đặt thêm cái nữa cho sao
4,san pham đẹp san pham đẹp so voi gia
5,năm sao rất hài_lòng về sản_phẩm da_đẹp tỉ_mỉ cẩn thẩn đén từng đường may mà giá lại siêu mềm cảm_ơn lazada rất nhiều nhé
3,tốt sản_phẩm tốt trong tầm giá
5,năm sao tui đẹp va re
5,mình đang dùng túi này thấy thích lắm mà giá_cả phải_chăng túi như quảng_cáo
5,tuyệt_vời túi da mềm đường may đẹp giá quá rẻ mình mua lúc không đang định đặt thêm mang đi làm hay đi chơi đều đc nhé rất trẻ_trung
4,bốn sao túi đẹp da_mềm mịn giá rẻ tôi rất hài_lòng về sản_phẩm tuy_nhiên giao hàng còn chậm đợi đến ngày thì quá lâu
5,năm sao mình rất hài_lòng
5,năm sao hàng ok rất thích
1,e đặt túi này sao mãi không thấy ibox_vậy
5,sao tôi thích sản_phẩm đã mua
5,chất_lượng tốt giá vậy là quá ok so với hàng
5,hai long ve_sản_phẩm va dich vu cua lazada tui xach nhu_hinh anh gia re giao hang nhanh tuyet voi lazada
3,rất tốt tôi hài_lòng về sản_phẩm của các bạn mẫu_mã đẹp từng đường chỉ rất chuẩn_xác không có lỗi giá_cả cực_kì hợp_lý cám_ơn lazada và latashop
5,đẹp rất ưng_ý mua lúc đang giảm_giá không sản_phẩm rất đẹp da mịn dày_dặn quai đeo chắc_chắn khuy nút dây kéo_đẹp
5,chất_lượng tốt hàng giao trong giờ thì chiều hôm trc đặt giờ tối hôm sau dậy đi nhận hàng chất_lượng hàng tốt chất_liệu da tốt chỉ may đẹp mầu_sắc vừa_mắt quan_trọng vợ mình vui cám_ơn cửa_hàng và lazada
1,gọi người bán không bắt mấy sản_phẩm thì không như_ý giá bán không đúng
5,hài_lòng
4,bốn sao đẹp nhưng hơi nhỏ
1,không hài_lòng tôi vừa nhận được túi_xách chất_liệu túi nhão form túi thì bị méo nhìn sản_phẩm không chắc_chắn
3,tạm
3,túi tốt chất_liệu thích giỏ gọn tiện_dụng nói chung thích
5,túi_xách đẹp gọn_nhẹ mình rất thích
5,tuyệt hàng y hình ok túi rất đẹp và quá rẻ so với giá tiền hài_lòng tuyệt_đối cho sao
1,túi xấu
1,hàng vàng_mã hàng quá xấu so với ảnh như đồ vàng_mã
4,túi hơi bé hàng tốt chất_lượng trừ mỗi điểm túi hơi bé
3,túi_xách ok rat thích
4,hai long hang giong hinhdepgia redinh lua nua ma het hang
5,năm sao rất ưng
5,năm_sao da_cung đẹp duong may tot
4,đẹp chat lieu tot đẹp nhu_hinh lata
4,bốn sao mới nhận hàng hôm_nay vơi giá không dùng đựng đồ_chơi chơi cũng ổn giống hìnhda cứng_cáp
5,sản_phẩm tốt sản_phẩm tốt đóng_gói cẩn_thận
5,tui đeo da_mềm e thích_vi nho bo dien thoại vô vua tui đeo chéo
4,sản_phẩm chấp_nhận được so với mô_tả và mức giá
1,một sao
5,túi đeo chéo lata hàng đẹp đúng với quãng cáo giao hàng nhanh thân thien rất hài_lòng cảm_ơn laza
4,xài êm_đẹp đc
5,đẹp nhu_hinh
4,bốn sao chất_lượng sản_phẩm tốt hơn mong_đợi
5,sản_phẩm tốt sản_phẩm tốt đóng_gói cẩn_thận
4,tốt sản_phẩm dùng ok với tầm giá này thì chất_lượng rất tốt
3,ba sao hàng phù_hợp với giá tiền
5,tuyệt_vời mua rất ưng í
5,tuyệt_vời sản_phẩm đẹp giao hàng nhanh giá_cả cũng hợp_lý
5,tốt mua được giá rẻ không hài_lòng da_mềm chắc gọn_nhẹ để ví bóp và điện_thoại vừa_phải không cồng_kềnh tiện_lợi
5,hàng đẹp dùng ok rất hài_lòng về sản_phẩm
1,một sao mình hài_lòng với sản_phẩm với giá tiền như_vậy thì sản_phẩm ổn rùi
5,dich vu tuong doi tot dat hang nhanh
4,tốt giao hàng nhanh hàng rất đẹp mình rất hài_lòng với sản_phẩm nhưng khi giao hàng mình không thấy có hóa_đơn giao hàng
4,đẹp moi toi hoi nho neu ban la nam_gioi
2,túi nhỏ xinh phù_hợp với giá tiền đã giảm nhưng không hài_lòng ở mùi của da túi mãi không thấy bay hết mùi hic
5,năm sao ok hài_lòng về sản_phẩm
5,tuyệt_túi da giống y_hình da rất đẹp rất đáng để mua sản_phẩm rất ưng í
5,túi đẹp túi đẹp sao
3,ba sao ví da cũng rất nhé nhưng ví tặng thì hơi kì
1,robt s repp một sao
2,hang re mà đep sai ok
3,hài_lòng mình rất thích túi chất đẹp hàng đẹp tuy màu không được đậm như hình
3,tốt hàng đẹp chất_liệu tốt dày_dặn rất vừa_ý
2,nhìn đẹp nhìn đẹp nhưng không bền đeo vào thì rớt dây rớt khóa tùm_lum
4,tot ok kich thuoc nho hon mau dam_hom da mem duong chi chac chan noi tom lai hai long
4,hàng ok túi đeo chéo
1,dởm tiền nào của nấy cũng tạm đc thôi
5,sản_phẩm đẹp hàng đẹp da sờ mềm thích gói hàng thì cẩn_thận vote sao
4,bốn sao túi đẹp giá rẻ nhưng màu hơi đậm hơn so với trong hình
3,ba_sao da_đẹp
5,tốt thực_sự hài_lòng sản_phẩm tốt giá_thành rẻ không
3,kính_mát nam chất_lượng chưa được tốt
5,túi đeo chéo lata hn mình mới nhận được sản_phẩm sáng nay rất ưng_ý sản_phẩm nhìn ngoài rất đẹp
5,tuyệt_vời túi rất đẹp và chắc_chắn giá lại rẻ sẽ mua tiếp
3,ba sao túi đẹp
5,năm sao túi đẹp da mềm chất_lượng tốt hài_lòng với sản_phẩm
5,giao hàng nhanh sản_phẩm đẹp giá rẻ rất ưng_ý với tất_cả sản_phẩm mình đã mua
3,ba sao hàng dùng được nhưng hơi đắt so với thực_tế
4,tốt
4,chất_lượng ok
4,chất_lượng túi dày_dặn chắc_chắn đường may đẹp khá hài_lòng với sản_phẩm này
5,năm sao
5,túi đẹp đường may cũng chắc_chắn cám_ơn lata cám_ơn lazada sao so với giá tiền
3,ba sao rất tốt
3,ba sao em rất ứng sản_phẩm rất đúng mục_đích của e
3,ba sao ok
3,ba sao tốt giao hàng nhanh hàng ưng_ý
5,túi đẹp tương_ứng với giá mình rất hài_lòng
5,hài_lòng với sản_phẩm này sản_phẩm có thương_hiệu chất_liệu tốt giá giảm rẻ quá mình mua luôn cái
5,quá_sức hài_lòng cực_kì hài_lòng khi nhận được sản_phẩm rất đẹp mình rất rất thích luôn lại còn được bảo_hành nữa
5,hàng chất lương_y trong hình hàng đẹp đường may đẹp lần đầu mua mà ương ý lắm lun
4,thích mình đã đặt mua và dùng được một thời_gian túi khá chất_lượng túi đẹp đeo cũng khá bền với giá_cả như_vậy rất phù_hợp
5,năm sao spham đẹp dung nhu trong hinh anh dang ban minh mua tang sinh nhat nguoi duoc tang rat thich va khen gio tot duong chi may chac minh se tiep tuc ung ho thuong hieu lata nay
5,năm sao
5,tui sách tui sách mem êm giong như_lazada da gioi thieu toi rat hai long
4,bốn sao ok ngon bổ rẽ
5,năm sao giá_cả phải_chăng túi giống hình nói_chung ok
5,năm sao năm trước hàng đẹp bền mình rất ưng_ý
5,đánh_giá vừa_ý khi nhận sản_phẩm
5,năm sao
5,túi đeo chéo lata hàng rất chi là oke cảm_ơn lazada nhé
5,da đẹp ưng_ý lắm
4,hàng được mua để tặng nói túi_xách đ người được tặng không tin phải cao_giá hơn và cảm_ơn
3,túi chéo ok vải đẹp hợp túi_tiền
5,năm sao dày_dặn đẹp như hình rất thích
5,năm sao túi rất đẹp y_như hình đầy_đặn đường chỉ chắc_chắn giao hàng rất nhanh
1,giao hàng chậm quá hôm rồi mình vẫn chưa nhận được khi nào hàng về mình sẽ hoàn_trả lại cửa_hàng
1,một sao năm trước chất_lượng tốt
5,năm sao chất_lượng đúng như thông_tin sản_phẩm oke
5,tốt sản_phẩm tốt và đẹp như đúng cam_kết
4,tot
5,đẹp và rẻ dùng ok so với giá là quá ổn mua ở ngoài cùng loại phải trên không cám_ơn cửa_hàng và lazada
5,túi da đẹp túi đẹp da tốt rất ưng_ý tuy_nhiên mong lazada giao hàng nhanh hơn_nữa
4,bốn sao năm trước lan dau tien mua hang tren lazada hang giong nhu_hinh moi rat đẹp
5,năm sao cung được
2,tạm ổn
4,hỏi hôm trước có đăng_kí mua túi_xách da_bò thế này mà không thấy liên_hệ nên hỏi thử có hàng này không ạ
5,đẹp túi đẹp hơn mấy mẫu khác của lata đường may sắc_sảo xài rất bền
1,mua tặng bạn xài chưa bao_lâu đẫ đứt hàng vàng_mã
2,mình nhận được hàng rồi túi so với hình không giống lắm về kích_thước
5,rẻ đẹp màu_sắc đường may đẹp vải lót trong cũng rất tốt giao hàng lại nhanh rất vừa_ý
4,ưng_ý sản_phẩm đẹp so với giá nhưng logo nó không ở chính giữa sản_phẩm mà ở góc sản_phẩm không giống trên hình nhỉ nói_chung là ưng
5,năm sao tốt
5,năm sao nhận hàng hơi trễ nhưng chất_lượng ok giống mẫu đường may ngay_ngắn lớp lót bên trong đẹp hài_lòng về sản_phẩm
4,tốt hàng giống hình_hài_lòng
5,năm sao hàng đẹp da mềm cảm_ơn lazada
3,đẹp túi may chắc_chắn y_hình
2,hai sao
4,bốn sao sản_phẩm ổn ngoài việc màu đậm hơn so với hình thì còn lại tốt da mềm đường may chắc_chắn
5,hài_lòng sản_phẩm đẹp chắc_chắn giá rẻ cảm_ơn lata và lazada
5,rất đáng đồng_tiền
4,bóp đeo sản_phẩm đẹp giá tốt
5,rất đẹp cám_ơn lata và lazada túi may rất đẹp tôi không nghĩ hàng vn hơn trăm bạc mà_lại đẹp đến vậy trong tương_lai sẽ tiếp_tục mua đồ của các bạn
1,hàng may bị lỗi bởi_vậy nên mới bán giá do
4,hang tot lam_toi da mua va cong nhan hang rat tot
5,năm sao rất đẹp
1,không bao_giờ mua nữa
5,chất_lượng cực_kì đa mua đc gần tháng rồi mình thấy lata rất có uy_tín và hàng rất bền đẹp tuy_nhiên theo mình nếu muốn tương_lai sẽ còn đc biết đến rộng_rãi hơn nx lata nên đầu_tư đa_dạng mãu túi cho chị_em phụ_nữ vì chị em túi_xách là một phần cs rồi nên sẽ đầu_tư cho túi đẹp và nếu rẻ mà_bền thì càng tốt đặc_biệt đa_dạng màu hơn nhé lata các màu như đỏ xanh hồng bởi theo mình biết thì da có_thể nhuộm đc mỗi nâu với đen trông không hút mắt lắm
5,hàng đẹp và rẻ hơn mong_đợi mình mua khi sản_phẩm sale off nhưng không_thể tin được là túi đẹp đến thế chắc_chắn dày_dặn đường may rất cẩn_thận mình có nhiều túi qc đắt tiền gấp chục lần mà cũng không được như_vậy ủng_hộ lata dài_dài
3,ba sao túi rất đép giống_hệt trên ảnh t rất thich
5,túi túi đẹp chất_liệu ổn_mầu đẹp
5,túi đeo chéo lata_hn da_bò nhạt mình rất hài_lòng về chất_lượng của túi và cách làm_việc của lazada tặng sao
5,rất hài_lòng về sản_phẩm hii hi
5,la mùi túi đẹp
5,rất ok ok
4,bốn sao chất_lượng túi tốt hơn nhiều so với mình nghĩ khi mua với giá đó đường may chắc_chắn màu y_như hình_hài_lòng về sản_phẩm
5,hàng quá đẹp đúng là hàng vn chất_lượng cao túi da khá dày và mềm đường may chắc_chắn mình mua chiếc màu vàng nhạt nhìn rất đẹp dễ phối đồ có_điều kích_thước hơi nhỏ không đủ cho đựng vở đi học nên chỉ thích_hợp đeo đi chơi thôi
5,tốt hài_lòng
5,tốt quá bất_ngờ khi nhận đc hàng giá chỉ không theo tôi chỉ tiền công may là dư rồimay rất đẹp đường may sắc nét túi thì chỉ từ đẹp tuyệt_vời ông mặt_trời hơn những gì mình tưởng trước giờ mua hàng chưa sản_phẩm nào rẻ mà tốt ntn thật không_thể tin nổi sẽ đặt thêm sản_phẩm nữa làm_quà biếu acetks nhà phân_phối sản_phẩm nầy chúc bạn mua may bán đắc
5,túi da_bò nâu nhạt hài_lòng sản_phẩm đẹp đường may và khóa rất chắc_chắn kích_thước chuẩn giống như thông_tin đã cung_cấp màu túi đậm hơn so với ảnh chụp một_chút giao hàng đóng_gói sản_phẩm cẩn_thận mình rất ứng ý cám_ơn lazada
5,đẹp và chất sản_phẩm đẹp hơn hình luôn lần đầu_tiên mua cái túi da mà thấy hài_lòng chắc_chắn dày_dặn
5,ok mình mới nhận sản_phẩm giỏ đẹp đường may rất đều và đẹp da dày mềm ok giá rẻ
5,tốt rất vừa_ý hàng đẹp
4,bốn sao da memgiong y chang nhu_hinhnoi chung vua tui tien
5,túi đẹp túi đẹp gống hình ủng_hộ lazada nhiều hơn nữa cảnm ơn_lazada
4,nice đẹp hài_lòng
5,năm sao túi đẹp như hình đường may khá đẹp da mềm túi kích_thước vừa_vặn dễ kết_hợp đồ màu hơi đậm so với ảnh nhưng rất đẹp
4,bốn sao giá tốt sản_phẩm tốt đường may đẹp chất_liệu da ổn vải lót dày kích_thước túi hơi nhỏ
1,túi da ưng lắm đi chơi thật tuyệt cám_ơn lazada
4,bốn sao_đepchất da khá tốt
4,tốt trong tầm giá túi đẹp da tốt lớp lót êm_ái khóa kéo chắc_chắn nhưng hơi nhỏ chỉ đủ bỏ ví tiền và điện_thoại thôi
5,túi đeo chéo lata_hn da_bò nhạt mình rất hài_lòng về chất_lượng của túi và cách làm_việc của lazada tặng sao
5,năm sao túi đẹp y hình rất hài_lòng
5,tốt sản_phẩm đẹp và tốt như hình
3,ba sao túi đẹp chất_lượng đường may ưng_ý ok
4,bốn sao túi may chắc_chắn rất thích mỗi_tội màu đậm hơn so với hình
4,tốt sản_phẩm tốt
3,khá hài_lòng về sản_phẩm mình cũng là người hay mua hàng online cũng mua nhiều cửa_hàng nhưng đây là lần đầu_tiên mình mua trên lazada mình mới đặt_hàng chiều hôm_qua thì chiều hôm_nay đã nhận được hàng phải công_nhận lazada gói hàng rất kĩ mình rất thích và hàng nhận được thì màu_sắc như hình đường mau khá chắc nói_chung nhìn thích còn kích_thước thì đựng được quyên vớ khá là ok và mình cũng hài_lòng về cách xác_nhận đơn hàng hi_vọng lazada sẽ nhiều sản_phẩm giá_cả hợp_lý và chất_lượng tốt để phục_vụ khách_hàng
5,hải lòng hải lòng
4,ok năm trước chất_liệu cứng hơn mình nghĩ không mềm lắm màu_sắc đúng như hình dùng mấy tháng rồi chưa thấy bong tróc sứt chỉ dùng cũng được
4,tốt mua ngày giảm_giá còn kmjh rất hài_lòng về chất lượngđường may đẹpchắc chắntúi để đc ví và đtmàu thì nhạt hơn so với hìnhnchung là ok
5,hàng đẹp đường may chắc giá rẻ
4,khá tốt mới nhận hàng hôm_nay da_bò mềm màu không chuẩn như hình lắm màu như da_bò nhạt lớp lót đẹp đường may chắc_chắn kích_thước hơi nhỏ chỉ để được ipad mini để dùng lâu coi có bền không
5,quá chất_lượng giá rẻ mà chất_lượng thì quá tốt da mềm đường may chắc_chắn kiểu_dáng y_như hình rất đáng để mua giao hàng rất nhanh sẽ luôn ủng_hộ lata và lazada
2,hai sao tốt
1,một sao tốt
5,hai long mau ma đẹp chat lieu tot
2,kém da xấu nhàu giao hàng bị lỗi tróc da ngay gần nút gài
5,mình nhận đk hàng từ lazada hàng rất tốt d
5,túi đeo chéo hàng chất_lượng
4,hài_lòng về sản_phẩm da mềm đường chỉ chắc_chắn thiết_kế phù_hợp với nhu_cầu của minh
1,sản_phẩm bị lỗi dây đeo thiếu móc
5,năm sao túi đẹp mình mua đợt sale không thấy túi quá thích luôn hợp đi chơi
5,b năm sao hàng đẹp rất hài_lòng
1,một sao năm trước toi rat hai long ve_sản_phẩm mình mua tren lazada
3,sản_phẩm đẹp nhưng kích_thước nhỏ hơn lazada đã mô_tả chất_liệu tốt đường may đẹp nhưng giao cho mình nhầm màu mình đặt màu_da_bò nhạt nhưng nhận màu_da_bò đậm
5,tốt hàng rat tot duong may chac chancam on larada
5,rất đẹp ah
3,đẹp
4,bốn sao sản_phẩm đẹp chất_lượng tốt giá_cả hợp_lý
5,sản_phẩm tốt sản_phẩm đẹp và chất_lượng so với giá đó
5,năm sao túi khá đẹp giống hình trên trang khá hài_lòng
4,túi đẹp hài_lòng với sản_phẩm ok
5,tốt giao hàng nhanh hàng đúng mẩu
5,năm sao
4,bốn sao da mem nhung tui hoi nhototdang mua
4,túi đeo chéo đường may khá chắc_chắn màu túi ok chỉ là gói hàng bằng một tờ giấy có nhiều ng không để_ý lấy dao rọc giấy mở xẹc cái là đi luôn cái túi nên gói cho cẩn_thận bằng ba lớp để tránh trường_hợp trên
5,năm sao túi đẹp chất_lượng tốt tôi đã đặt mua tổng_cộng cái với giá không cái cảm_ơn lazada
5,thích quá bất_ngờ về sản_phẩm_giá rất rẻ chất_lượng lại miễn chê mình sẽ giới_thiệu nhiều ng mua chế_độ bảo_hành cũng rất ok đặc_biệt giao hàng cực nhanh
4,ghia nguyen túi da mềm đường may sắt sảo
5,túi của lata đã mua và đã sử_dụng túi y hìnhđường may đẹpthương hiệu lata tôi nghĩ mọi người nên sử_dụng
5,túi full đẹp lun lại đc giảm_giá tuyệt_vời túi đẹp cả trong lẫn ngoài
3,ba sao mình thấy rất hài_lòng
4,gio xách lata hang nhu_hình rat tot
1,không nhưa quảng_cáo có mỗi ngăn có mỗi ngăn làm quái gì có ngăn khoá như hình quảng_cáo
5,tốt đã nhận hàng nhanh hơn kế_hoạch hàng đẹp thích
5,túi đẹp tốt mình rất hài_lòng
5,phương ok
5,năm sao dakieu deu rat đẹp va vua y nuarat vua y
4,bốn sao sản_phẩm ổn màu_da giống hình chỉ may tốt bên trong vải nỉ nên bất_ngờ chút
5,tốt mình hài_lòng về chất_lượng vì không nghĩ giá_như vậy_mà được hàng tốt mỗi_tội giao hàng chậm quá
4,hài_lòng giao hàng nhanh gói hàng cũng đẹp nữa về chiếc túi thì mẫu_mã giống trong mô_tả dây đeo chắc_chắn nhưng có_điều màu hơi nhạt hơn so với trong hình tý n_hưng sản_phẩm_chất_lượng rất ok
5,đẹp chất_liệu bên trong mềm mạirất ưng_ý sản_phẩm nàymình fải mua thêm cái dùm chị hàng_xóm đó
3,ba sao túi đeo giống như hình đẹpnhưng hơi nhỏ
3,ba sao gio đẹp gia ca vua tui tien cong_nhan
4,bốn sao sản_phẩm như mô_tả đường may cẩn_thận hài_lòng với sản_phẩm
5,túi đeo chéo hàng chất_lượng bền_đẹp
5,tuyệt_vời chất_lượng ok sao
5,năm sao minh rat hai long ve_san pham
5,chất_lượng tốt giá rẻ em này đẹp như hình đường may chắc_chắn da_mềm nên đeo rất thoải_mái bên trong lót vải cũng mềm nch là rất ưng_ý chắc phải mua thêm cái nữa
4,bốn sao túi đẹp đúng như thông_tin sản_phẩm
4,bốn sao năm trước đẹp giống hình lóp vải bên trong ok giá mềm
5,năm sao đã nhận được sản_phẩm vô_cùng ưng_ý
1,một sao gia tot kieu depda depok
2,tạm được hơi nhỏ lúc mua không để_ý kích_cỡ mua về thì cảm_giác túi nhỏ là nam đeo thì hơi dở nhìn trông_ái ái thích_hợp với nữ hơn
5,năm sao sản_phẩm này nhìn khá thời_trang bắt_mắt nhé mình mua cho em nó dùng rất tốt vì dùng lâu rồi mà còn như mới luôn hé
4,bốn sao duoc gia tot chat luong
5,rất hài_lòng túi đẹp ngoài sự mong_đợi của mình quá rẻ cho sản_phẩm_chất_lượng giao hàng nhanh ngoài dự_kiến
5,ok tui đẹp vua y
4,bốn sao tốt
5,năm sao túi đúng hìnhda mềm đẹp thikkk
5,năm sao san pham tuyet voi day duong may chac chan toi rat thich nen mua them cai nua tang cho ban
5,sản_phẩm như hình sản_phẩm đẹp đường may tỉ_mẩn đáng tiền ui moa
1,nói_chung thì với giá tiền này túi là phù_hợp chứ cũng chẳng sale với không sale gì nhìn thì đẹp mà nhận thì chất_lượng hơi chán dây đeo dài quá bây_giờ làm thế_nào để tháo ra đây
4,túi quai chéo cảm_ơn lazada mình nhận được hàng sớm hơn nhiều so với dự_kiến túi đẹp tuy_nhiên màu đậm hơn so với ảnh
4,bốn sao sản_phẩm tốt đúng như hình
4,chiếc túi rất đẹp chiếc túi rất đẹp thích_hợp đi chơi đi học thêm vì nếu bỏ tập chỉ bỏ được quyển nói_chung đây là một sản_phẩm khá tốt với giá cực_kì phải_chăng mong là sẽ mau_chóng có thêm nhiều mẫu mới với chất_lượng ngày_càng tốt hơn cảm_ơn lazada
3,ba sao mình ưng_ý với sản_phẩm đã mua
5,rất hài_lòng mua bữa giá không da đẹp rất chắc_chắn mình cực thích
5,năm sao giao hàng nhanh hơn dự_kiến sản_phẩm đc đóng_gói tốt chất_lượng sản_phẩm rất ok dây đeo khá chắc_chắn giả rẻ nữa nên mua các bạn ạ
4,rất thích mình rất vui về chiếc túi này mới mang con bạn thấy cũng muốn mua một chiếc giá thì cũng khá là hợp_lý và hợp với túi_tiền của mình đường may chắc_chắn không bị lỗi chút nào hết bên trong được may bằng vải nhung rất êm không lo bị thủng_xước khi để vật nhọn sắc_bén và có nhiều ngăn_nhỏ
4,sản_phẩm đẹp
4,tốt túi dày_dặn đường may chắc_chắn và da đẹp hơn so suy_nghĩ của mình nhưng màu đậm hơn trong hình chút
5,hàng dùng ổn chất_liệu đẹp chú_ý là hàng cho nữ nam dùng không hợp lắm
5,năm sao túi da_bò nhìn chắc_chắn đường may tinh_xảo đeo lên nhìn rất đẹp đựng được khá nhiều đồ giao hàng nhanh_chóng đúng lúc cần cảm_ơn lazada nhé
4,bốn sao sản_phẩm đẹp như hình
5,tốt tốt giao hàng nhanh hàng chất_lượng tốt rất hài_lòng về sản_phẩm này
5,sao rưỡi túi to hơn hình tí nhưng cũng ok ai thích đơn_giản thì chọn vì chỉ có vài ngăn nổi_bật thôi
4,tốt hàng rất chắn chắn phù_hợp với giá tiền có_điều còn đường kẻ may chưa xóa bằng viết nhủ mình không xóa_đc hên là không rõ lắm
4,bốn sao mình nhận được hàng các bạn gửi rồi hàng như ảnh dùng tốt xin cảm_ơn
5,hàng rẻ mà chất_lượng giao hàng cực nhanh mình cũng không ngờ luôn chất_lượng quá ổn so với mức giá đường may nhìn khá chắc_chắn tuy_nhiên màu hơi đậm so với hình nhưng nhìn cũng ok lắm sẽ ủng_hộ hàng lata dài_dài
4,ltúi da mềm đẹp túi đẹp tuy_nhiên hơi già dùng cho trung_niên phù_hợp
3,ba sao bình_thường
4,sản_phẩm vừa_ý dùng rất tiện_lợi vừa túi_tiền với công_chức sản_phẩm vừa_ý dùng rất tiện_lợi vừa túi_tiền với công_chức
4,tốt
5,ok hài_lòng
5,đẹp chất_lượng ok túi mk nhận đk y_như hình mk chọn giao hàng tiết_kiệm nhưng lazada giao hàng sớm hơn dự_kiến da chắc_chắn đường may cũng đẹp nữa
5,rất hài_lòng hàng đẹp túi vừa_phải đựng vừa ipad nói_chung là rất thích cảm_ơn anh giao hàng thân_thiện ạ
3,ba sao chất_liệu đẹp tuy_nhiên đường may hơi sâu nên lòng túi hơi nhỏnói chung là chất_lượng và giá_cả hợp_lý
3,ba sao mình rất thích sản_phẩm này mình thấy nó hợp với mình đơn_giản nhưng vẫn sang trọngchất_liệu da_bò mềm_mại giá_cả lại rẻ hơn minh mua ngoài các cửa_hàng và mặt khách giao hàng rất nhanh_chóng nói_chung cũng mới mua một và sản_phẩm nhưng mình rất thích dịch_vụ của lazada
4,bốn sao
4,hàng chất_lượng hàng đẹp giá rẽ nhân_viên giao hàng nhanh
